{
  "$schema": "../suites/schema.json",
  "name": "smoke",
  "cloud": {
    "server_type": "cpx12",
    "location": "fsn1",
    "image": "ubuntu-24.04"
  },
  "suite": "smoke",
  "profile": "smoke",
  "workload": {
    "name": "smoke",
    "scale_factor": 1,
    "queries": []
  },
  "execution": {
    "warmups": 0,
    "iterations": 1
  },
  "publish": {
    "branch": "main"
  }
}
